{
  "evidence_input_version": "access_pod_enterprise_evidence_input_v1.0",
  "csc_id": "csc_qpathformer_enterprise_access_mode_runtime_demo_20260413",
  "status": "active",
  "issued_at": "2026-04-13T10:05:00Z",
  "expires_in_days": 180,
  "profile_id": "sector.public.v1",
  "issuer": {
    "org_id": "policyofdevelopments.qpathformer",
    "name": "Policy of Developments - Q-Pathformer Enterprise",
    "key_id": "kid-qpathformer-enterprise-demo-001",
    "contact": {
      "email": "registry@policyofdevelopments.org",
      "web": "https://policyofdevelopments.org"
    },
    "jurisdiction": "AU"
  },
  "subject": {
    "subject_id": "qpathformer_enterprise_access_mode_runtime",
    "name": "Q-Pathformer Enterprise Access-Mode Runtime",
    "type": "platform",
    "owner": {
      "org_id": "policyofdevelopments",
      "name": "Policy of Developments"
    },
    "version": "v1.0"
  },
  "scope": {
    "ai_types": [
      "LLM",
      "agentic"
    ],
    "deployment": "hybrid",
    "jurisdictions": [
      "AU"
    ],
    "sectors": [
      "public"
    ],
    "risk_tier_declared": "medium",
    "use_constraints": [
      "No autonomous high-impact decisions without human review.",
      "Runtime-generated signals remain non-authoritative until governed review."
    ]
  },
  "telemetry_window": {
    "start": "2026-04-12T09:00:00Z",
    "end": "2026-04-13T09:52:08Z"
  },
  "sapp": {
    "maturity_level": 4,
    "run_id": "RTRUN-llm-runtime-registration-check-20260413T095208Z-77a538bc",
    "run_at": "2026-04-13T09:52:08Z",
    "environment": "preprod"
  },
  "evidence": {
    "bundle_id": "bundle_qpathformer_enterprise_access_mode_runtime_20260413",
    "items": [
      {
        "type": "telemetry_export",
        "path": "path_2_access_mode_canonical/02_signals/runtime_generated/signal_runtime_20260413T095208Z_77a538bc.json"
      },
      {
        "type": "attestation",
        "path": "shared/registry/run_references/RTRUN-llm-runtime-registration-check-20260413T095208Z-77a538bc.runtime_signal_run_reference.json"
      },
      {
        "type": "policy_bundle",
        "path": "shared/registry/run_registry.json"
      },
      {
        "type": "simulation_report",
        "path": "shared/models/evaluation/model_runs/MRUN-grouped_sparse_e64-20260327T110302Z-cb039d3b/benchmark_summary.json"
      },
      {
        "type": "model_card",
        "path": "shared/models/evaluation/model_runs/MRUN-grouped_sparse_e64-20260327T110302Z-cb039d3b/model_run_manifest.json"
      },
      {
        "type": "dataset_card",
        "path": "path_2_access_mode_canonical/03_dataset/training_packages/id2-20260411-1400-qpath-tr008-run__v10-1-path2-source-bridge__20260412T104656Z/state1_training_manifest.json"
      }
    ]
  },
  "metric_observations": [
    {
      "metric_id": "SEC_ATTACK_DETECT_RATE",
      "value": 0.985,
      "confidence": 0.86
    },
    {
      "metric_id": "SEC_FALSE_NEG_RATE",
      "value": 0.005,
      "confidence": 0.82
    },
    {
      "metric_id": "HARD_REDTEAM_PASS_RATE",
      "value": 0.97,
      "confidence": 0.84
    },
    {
      "metric_id": "HARD_PATCH_LATENCY",
      "value": 36.0,
      "confidence": 0.76
    },
    {
      "metric_id": "COMP_POLICY_TRACE_COVERAGE",
      "value": 0.99,
      "confidence": 0.88
    },
    {
      "metric_id": "COMP_TIME_TO_ADAPT",
      "value": 24.0,
      "confidence": 0.8
    },
    {
      "metric_id": "GOV_HIL_REVIEW_COVERAGE",
      "value": 0.99,
      "confidence": 0.85
    },
    {
      "metric_id": "GOV_HUMAN_LOAD_INDEX",
      "value": 0.6,
      "confidence": 0.78
    },
    {
      "metric_id": "TRN_EXPLAIN_COMPLETE",
      "value": 0.94,
      "confidence": 0.8
    },
    {
      "metric_id": "TRN_USER_COMPREHENSION",
      "value": 0.89,
      "confidence": 0.77
    },
    {
      "metric_id": "SECTOR_POLICY_PASS_RATE",
      "value": 0.97,
      "confidence": 0.79
    },
    {
      "metric_id": "SECTOR_REPUTATION_STABILITY",
      "value": 0.71,
      "confidence": 0.74
    }
  ],
  "iso_alignment": {
    "iso_iec_42001": {
      "status": "partial",
      "notes": "Governance controls are present in the enterprise platform but external audit is not yet complete.",
      "controls_mapped": [
        "AIMS-roles",
        "AIMS-improvement-loop"
      ]
    },
    "iso_iec_23894": {
      "status": "aligned",
      "notes": "Risk and treatment traces are present in the governed lifecycle and runtime review path.",
      "controls_mapped": [
        "risk-identify",
        "risk-treat",
        "risk-monitor"
      ]
    },
    "iso_iec_22989": {
      "status": "aligned",
      "notes": "Vocabulary alignment is maintained across the platform and Access-PoD standards artifacts.",
      "controls_mapped": [
        "ai-system",
        "ai-model",
        "inference",
        "training"
      ]
    }
  },
  "scoring_policy": {
    "top_metrics_per_factor": 3,
    "min_overall_metric_coverage_ratio": 0.2,
    "min_metrics_per_factor": 2,
    "min_factor_score": 60.0,
    "level_thresholds": {
      "2": 60.0,
      "3": 70.0,
      "4": 80.0,
      "5": 90.0,
      "6": 97.0
    }
  }
}
